[
  {
    "id": "nlp_math_1743",
    "subject": "math",
    "text": "Розв’яжіть нерівність 4⋅3^x<3^x+6\n.",
    "choices": [
      "(−∞;log9(⁡6))",
      "(−∞;log2(⁡3))",
      "(−∞;2)",
      "(−∞;1)",
      "(−∞;log3(⁡2))"
    ],
    "correct_answer_index": 4,
    "exam_type": "ZNO_NMT_General"
  },
  {
    "id": "nlp_math_1744",
    "subject": "math",
    "text": "Розв’яжіть систему рівнянь {3√x=12, x−2y=26}. Якщо (x_0;y_0) – розв’язок системи, то x_0+y_0=",
    "choices": [
      "11",
      "21",
      "−7",
      "−10",
      "−14"
    ],
    "correct_answer_index": 0,
    "exam_type": "ZNO_NMT_General"
  },
  {
    "id": "nlp_math_1745",
    "subject": "math",
    "text": "(7−(sin^2⁡β+cos^2⁡β))/(3sin^2⁡β+3cos^2⁡β)=",
    "choices": [
      "7/6",
      "7/3",
      "8/3",
      "12",
      "2"
    ],
    "correct_answer_index": 4,
    "exam_type": "ZNO_NMT_General"
  },
  {
    "id": "nlp_math_1746",
    "subject": "math",
    "text": "Сума довжин усіх ребер прямокутного паралелепіпеда, що виходять з однієї вершини, дорівнює 60 см. Визначте суму довжин усіх ребер цього паралелепіпеда.",
    "choices": [
      "360 см",
      "240 см",
      "180 см",
      "120 см"
    ],
    "correct_answer_index": 1,
    "exam_type": "ZNO_NMT_General"
  },
  {
    "id": "nlp_math_1748",
    "subject": "math",
    "text": "З кошика, у якому лежать 4 зелених і 5 жовтих яблук, виймають навмання одне яблуко. Яка ймовірність того, що це яблуко буде жовтого кольору?",
    "choices": [
      "1/2",
      "1/9",
      "4/9",
      "5/9",
      "1/5"
    ],
    "correct_answer_index": 3,
    "exam_type": "ZNO_NMT_General"
  },
  {
    "id": "nlp_math_1749",
    "subject": "math",
    "text": "Спростіть вираз 3(1–х)(1+х).",
    "choices": [
      "3−3x^2",
      "3−x^2",
      "3+3x^2",
      "3+x^2",
      "3+6x−3x^2"
    ],
    "correct_answer_index": 0,
    "exam_type": "ZNO_NMT_General"
  },
  {
    "id": "nlp_math_1750",
    "subject": "math",
    "text": "Визначте число, 25% якого дорівнює 50.",
    "choices": [
      "0,5",
      "2",
      "12,5",
      "100",
      "200"
    ],
    "correct_answer_index": 4,
    "exam_type": "ZNO_NMT_General"
  },
  {
    "id": "nlp_math_1751",
    "subject": "math",
    "text": "Які з наведених тверджень щодо довільної трапеції ABCD (BC || AD) є правильними? I. ∠BAD+∠ABC=180∘ II. ∠BCA=∠CAD III. AC=BD",
    "choices": [
      "лише І",
      "лише І та ІІ",
      "лише І та ІІІ",
      "лише ІІ та ІІІ",
      "І, ІІ та ІІІ"
    ],
    "correct_answer_index": 1,
    "exam_type": "ZNO_NMT_General"
  },
  {
    "id": "nlp_math_1752",
    "subject": "math",
    "text": "Спростіть вираз 2cos⁡(450∘+α)−sin⁡α.",
    "choices": [
      "sin⁡α",
      "−3sin⁡α",
      "−2cos⁡α−sin⁡α",
      "2cos⁡α−sin⁡α",
      "3sin⁡α"
    ],
    "correct_answer_index": 1,
    "exam_type": "ZNO_NMT_General"
  },
  {
    "id": "nlp_math_1756",
    "subject": "math",
    "text": "Точки A та B лежать на сфері радіуса 10 см. Укажіть найбільше можливе значення довжини відрізка AB.",
    "choices": [
      "20 см",
      "100π см",
      "10 см",
      "20π см"
    ],
    "correct_answer_index": 0,
    "exam_type": "ZNO_NMT_General"
  },
  {
    "id": "nlp_math_1757",
    "subject": "math",
    "text": "Точки A, B, C та D лежать в одній площині. Які з наведених тверджень є правильними?\nI. Якщо точка B належить відрізку CD, то CB+BD=CD.\nII. Якщо точка A не належить відрізку CD, то CA+AD<CD.\nIII. Якщо відрізок CD перетинає відрізок AB в точці О під прямим кутом i AO=OB, то AC=CB.",
    "choices": [
      "лише І та ІІ",
      "лише І",
      "лише І та ІІІ",
      "лише ІІ",
      "І, ІІ та ІІІ"
    ],
    "correct_answer_index": 2,
    "exam_type": "ZNO_NMT_General"
  },
  {
    "id": "nlp_math_1758",
    "subject": "math",
    "text": "Укажіть проміжок, якому належить корінь рівняння √(x+12)=3.",
    "choices": [
      "[–12; –6)",
      "[–6; 0)",
      "[0; 6)",
      "[6; 12)",
      "[12; +∞)"
    ],
    "correct_answer_index": 1,
    "exam_type": "ZNO_NMT_General"
  },
  {
    "id": "nlp_math_1759",
    "subject": "math",
    "text": "Спростіть вираз (3m−2n)/8−3m/8.",
    "choices": [
      "−n/4",
      "−n/8",
      "−n/6",
      "−m/4",
      "(3m−n)/4"
    ],
    "correct_answer_index": 0,
    "exam_type": "ZNO_NMT_General"
  },
  {
    "id": "nlp_math_1761",
    "subject": "math",
    "text": "Укажіть правильну подвійну нерівність, якщо a=0,5^(−1), b=0,2, c=\\log_{0,2}5.",
    "choices": [
      "c<b<a",
      "b<c<a",
      "a<c<b",
      "c<a<b",
      "b<a<c"
    ],
    "correct_answer_index": 0,
    "exam_type": "ZNO_NMT_General"
  },
  {
    "id": "nlp_math_1764",
    "subject": "math",
    "text": "Якому з наведених проміжків належить корінь рівняння x/(9−x)=1/2?",
    "choices": [
      "(-∞; -5]",
      "(-5; -2]",
      "(-2; 2]",
      "(2; 5]",
      "(5; +∞)"
    ],
    "correct_answer_index": 3,
    "exam_type": "ZNO_NMT_General"
  },
  {
    "id": "nlp_math_1765",
    "subject": "math",
    "text": "Укажіть похідну функції f(x)=(2x−3)/x.",
    "choices": [
      "f'(x)=3/(x^2)",
      "f'(x)=3/x",
      "f'(x)=(4x−3)/(x^2)",
      "f'(x)=−3/(x^2)",
      "f'(x)=2"
    ],
    "correct_answer_index": 0,
    "exam_type": "ZNO_NMT_General"
  },
  {
    "id": "nlp_math_1767",
    "subject": "math",
    "text": "Установіть відповідність між функцією (1-3) і властивістю (А – Д) її графіка.",
    "choices": [
      "y=\\log_2 x",
      "y=x^2+3",
      "y=cos⁡x",
      "не перетинає вісь y",
      "паралельний осі x",
      "розташований у всіх координатних чвертях",
      "має лише одну спільну точку з графіком рівняння x^2+y^2=9",
      "симетричний відносно початку координат"
    ],
    "correct_answer_index": 3,
    "exam_type": "ZNO_NMT_General"
  },
  {
    "id": "nlp_math_1768",
    "subject": "math",
    "text": "Які з наведених тверджень є правильними?\nI. Навколо будь-якого ромба можна описати коло.\nII. Діагоналі будь-якого ромба взаємно перпендикулярні.\nIII. У будь-якому ромбі всі сторони рівні.",
    "choices": [
      "лише І та ІІ",
      "лише І і ІІІ",
      "лише ІІ",
      "лише ІІ та ІІІ",
      "І, ІІ та ІІІ"
    ],
    "correct_answer_index": 3,
    "exam_type": "ZNO_NMT_General"
  },
  {
    "id": "nlp_math_1769",
    "subject": "math",
    "text": "Укажіть проміжок, якому належить корінь рівняння (1/3)^(2x−1)=9.",
    "choices": [
      "(−∞;−1]",
      "(−1;0]",
      "(0;1]",
      "(1;2]",
      "(2;+∞]"
    ],
    "correct_answer_index": 1,
    "exam_type": "ZNO_NMT_General"
  },
  {
    "id": "nlp_math_1770",
    "subject": "math",
    "text": "sin^2(⁡2x)=",
    "choices": [
      "2sin^2(⁡x)",
      "4sin^2(⁡x)",
      "4sin^2(⁡x)cos^2(⁡x)",
      "2sin^2(⁡x)cos^2⁡(x)",
      "sin⁡4x^2"
    ],
    "correct_answer_index": 2,
    "exam_type": "ZNO_NMT_General"
  },
  {
    "id": "nlp_math_1772",
    "subject": "math",
    "text": "Розв’яжіть рівняння 2x−3=4.",
    "choices": [
      "0,5",
      "3,5",
      "2/7",
      "5",
      "–0,5"
    ],
    "correct_answer_index": 1,
    "exam_type": "ZNO_NMT_General"
  },
  {
    "id": "nlp_math_1773",
    "subject": "math",
    "text": "\\log_5 49+2\\log_5\\frac 57=",
    "choices": [
      "25",
      "\\log_5 70",
      "\\log_5 49\\frac 57",
      "\\log_5 35",
      "2"
    ],
    "correct_answer_index": 4,
    "exam_type": "ZNO_NMT_General"
  },
  {
    "id": "nlp_math_1775",
    "subject": "math",
    "text": "Розв'яжіть нерівність 3^x<27⋅3^(−x).",
    "choices": [
      "(−∞; 2/3)",
      "(3/2; +∞)",
      "(−∞; 3)",
      "(2/3; +∞)",
      "(−∞; 3/2)"
    ],
    "correct_answer_index": 4,
    "exam_type": "ZNO_NMT_General"
  },
  {
    "id": "nlp_math_1779",
    "subject": "math",
    "text": "Установіть відповідність між числовим виразом (1–3) та його значенням (А – Д), якщо a=25/4",
    "choices": [
      "2a/3",
      "1/a",
      "|9−2a|",
      "2*1/2",
      "4/25",
      "3*1/2",
      "4*1/6",
      "−3*1/2"
    ],
    "correct_answer_index": 6,
    "exam_type": "ZNO_NMT_General"
  },
  {
    "id": "nlp_math_1780",
    "subject": "math",
    "text": "Спростіть вираз 2(x+5y)−(4y−7x).",
    "choices": [
      "9x+y",
      "9x+14y",
      "−5x+6y",
      "9x+6y",
      "16x+2y"
    ],
    "correct_answer_index": 3,
    "exam_type": "ZNO_NMT_General"
  },
  {
    "id": "nlp_math_1781",
    "subject": "math",
    "text": "Установіть відповідність між виразом (1–3) та проміжком (А – Д), якому належить його значення.",
    "choices": [
      "|−1,6|+2",
      "√24/√3",
      "2cos⁡π/3",
      "(−∞; 0)",
      "[0; 1)",
      "[1; 2)",
      "[2; 3)",
      "[3; +∞)"
    ],
    "correct_answer_index": 7,
    "exam_type": "ZNO_NMT_General"
  },
  {
    "id": "nlp_math_1782",
    "subject": "math",
    "text": "Установіть відповідність між початком речення (1 3) і його закінченням (А – Д) так, щоб утворилося правильне твердження.",
    "choices": [
      "Графік функції y=−x^3",
      "Графік функції y=√x",
      "Графік функції y=cos⁡x",
      "розміщено лише в першій і другій координатних чвертях.",
      "має з графіком рівняння x^2+y^2=9 лише одну спільну точку.",
      "симетричний відносно осі y.",
      "симетричний відносно початку координат.",
      "не має спільних точок із графіком рівняння x=0."
    ],
    "correct_answer_index": 6,
    "exam_type": "ZNO_NMT_General"
  },
  {
    "id": "nlp_math_1783",
    "subject": "math",
    "text": "Розв’яжіть нерівність log0,9⁡(3x)>2.",
    "choices": [
      "(−∞;0,27)",
      "(−∞;0,6)",
      "(0,27; +∞)",
      "(0,6; +∞)",
      "(0;0,27)"
    ],
    "correct_answer_index": 4,
    "exam_type": "ZNO_NMT_General"
  },
  {
    "id": "nlp_math_1785",
    "subject": "math",
    "text": "Установіть відповідність між виразом (1-3) і твердженням про його значення (А – Д), яке є правильним, якщо a=−2*1/3.",
    "choices": [
      "a^2",
      "a+|a|",
      "log5(⁡5^a)",
      "більше від 5",
      "належить проміжку (0; 1)",
      "є від'ємним числом",